{
  "$schema": "https://json-schema.org/draft/2020-12/schema",
  "title": "Scoop Manifest",
  "type": "object",
  "additionalProperties": true,
  "properties": {
    "version": { "type": "string" },
    "description": { "type": "string" },
    "homepage": { "type": "string" },
    "license": { "type": ["string", "object"] },
    "url": { "type": ["string", "array"] },
    "hash": { "type": ["string", "array"] },
    "bin": { "type": ["string", "array"] },
    "shortcuts": {
      "type": "array",
      "items": {
        "type": "array",
        "items": { "type": "string" },
        "minItems": 2
      }
    },
    "installer": { "type": ["object", "array"] },
    "extract_dir": { "type": "string" },
    "pre_install": { "type": ["string", "array"] },
    "post_install": { "type": ["string", "array"] },
    "uninstaller": { "type": ["object", "array"] },
    "persist": { "type": ["string", "array", "object"] },
    "architecture": { "type": "object" },
    "checkver": { "type": ["string", "object"] },
    "autoupdate": { "type": ["object", "array"] }
  },
  "required": ["version", "description", "homepage"],
  "anyOf": [
    { "required": ["url", "hash"] },
    { "required": ["architecture"] }
  ]
}
