{
  "version": "2.8",
  "description": "Optimizer tool for NinjaTrader",
  "homepage": "https://bestorderflow.com/",
  "license": "Proprietary",
  "url": "https://bestorderflow.com/images/free/NTOptimizer.zip",
  "bin": "NTOptimizer.exe",
  "shortcuts": [
    [
      "NTOptimizer.exe",
      "NTOptimizer",
      "",
      "NTOptimizer.ico"
    ]
  ],
  "hash": "sha256:f4e9e8b7a843f267bade7f4ca954ccf9197d5dcb50edc97d4d98901a9a7861a8"
}
