{
  "version": "1.4.5",
  "description": "Antigravity CLI (agy) - An agentic coding assistant in your terminal by Google DeepMind",
  "homepage": "https://antigravity.google",
  "license": "Freeware",
  "architecture": {
    "64bit": {
      "url": "https://storage.googleapis.com/antigravity-public/antigravity-cli/1.4.5-4952523841339392/windows-x64/cli_windows_x64.exe#/agy.exe",
      "hash": "sha256:d191b2e423c8c5a96ffba84699dd5f52f4eec0e74bb457e8d5f755dc55528f9d"
    },
    "arm64": {
      "url": "https://storage.googleapis.com/antigravity-public/antigravity-cli/1.4.5-4952523841339392/windows-arm/cli_windows_arm64.exe#/agy.exe",
      "hash": "sha256:eef8ffeb8d425fc584beef6294f18eee1d587794b67a76938a1471436dab0202"
    }
  },
  "bin": [
    "agy.exe",
    [
      "agy.exe",
      "antigravity"
    ]
  ],
  "checkver": {
    "url": "https://antigravity-cli-auto-updater-974169037036.us-central1.run.app/manifests/windows_amd64.json",
    "regex": "\"version\":\\s*\"([\\d.]+)\",\\s*\"url\":\\s*\"https://storage\\.googleapis\\.com/antigravity-public/antigravity-cli/[\\d.]+-([\\d]+)/"
  },
  "autoupdate": {
    "architecture": {
      "64bit": {
        "url": "https://storage.googleapis.com/antigravity-public/antigravity-cli/$version-$match1/windows-x64/cli_windows_x64.exe#/agy.exe",
        "hash": {
          "url": "https://antigravity-cli-auto-updater-974169037036.us-central1.run.app/manifests/windows_amd64.json",
          "jsonpath": "$.sha512"
        }
      },
      "arm64": {
        "url": "https://storage.googleapis.com/antigravity-public/antigravity-cli/$version-$match1/windows-arm/cli_windows_arm64.exe#/agy.exe",
        "hash": {
          "url": "https://antigravity-cli-auto-updater-974169037036.us-central1.run.app/manifests/windows_arm64.json",
          "jsonpath": "$.sha512"
        }
      }
    }
  }
}
