{
  "version": "2",
  "description": "Unraid USB Creator - Create bootable Unraid USB drives",
  "homepage": "https://unraid.net/",
  "license": "Proprietary",
  "url": "https://releases.unraid.net/dl/stable/usb-creator.exe",
  "hash": "sha256:7e29f1f907488e5fedc6044e1f2256abc55250b21bafede28e78af02ebedc7c4",
  "installer": {
    "script": [
      "Start-Process \"$dir\\usb-creator.exe\" -ArgumentList '/VERYSILENT', '/SUPPRESSMSGBOXES', '/NORESTART' -Wait"
    ]
  },
  "checkver": {
    "url": "https://unraid.net/download",
    "regex": "USB Creator ([\\d.]+)"
  }
}
