{
    "version": "0.11.0",
    "description": "Cerebro is an open-source launcher with a focus on user experience, extensibility, and search accuracy",
    "homepage": "https://cerebroapp.com",
    "license": "MIT",
    "architecture": {
        "64bit": {
            "url": "https://github.com/cerebroapp/cerebro/releases/download/v0.11.0/Cerebro-0.11.0.exe",
            "hash": "e51696d00df7f0bcb444be3ebb898ac25bdd274a3df35ddcc3c05dbb52841873"
        }
    },
    "bin": "Cerebro-0.11.0.exe",
    "shortcuts": [
        [
            "Cerebro-0.11.0.exe",
            "Cerebro"
        ]
    ],
    "checkver": {
        "github": "https://github.com/cerebroapp/cerebro"
    },
    "autoupdate": {
        "architecture": {
            "64bit": {
                "url": "https://github.com/cerebroapp/cerebro/releases/download/v$version/Cerebro-$version.exe"
            }
        },
        "bin": "Cerebro-$version.exe",
        "shortcuts": [
            [
                "Cerebro-$version.exe",
                "Cerebro"
            ]
        ]
    }
}