{
  "version": "4.50",
  "description": "HDD Low Level Format Tool (Portable) - A utility for low-level formatting of SATA, IDE, SAS, SCSI or SSD drives",
  "homepage": "https://hddguru.com/software/HDD-LLF-Low-Level-Format-Tool/",
  "license": "Freeware",
  "url": "https://hddguru.com/software/HDD-LLF-Low-Level-Format-Tool/HDDLLF.4.50.exe",
  "hash": "sha256:3c5ef6834beb306d0a61f9faf41586b94d1a22d66cc1cd3b62d04ca8dd50fddd",
  "bin": "HDDLLF.4.50.exe",
  "shortcuts": [
    [
      "HDDLLF.4.50.exe",
      "HDD Low Level Format Tool"
    ]
  ],
  "checkver": {
    "url": "https://hddguru.com/software/HDD-LLF-Low-Level-Format-Tool/",
    "regex": "HDDLLF\\.([\\d\\.]+)\\.exe"
  },
  "autoupdate": {
    "url": "https://hddguru.com/software/HDD-LLF-Low-Level-Format-Tool/HDDLLF.$version.exe"
  }
}
