{
  "version": "7.5.1",
  "description": "USB Safely Remove (Portable) - Safe removal of USB devices",
  "homepage": "https://safelyremove.com/download.htm",
  "license": "Proprietary",
  "url": "https://safelyremove.com/assets/exe/usbsafelyremovesetup_7-5-1.zip",
  "hash": "sha256:31aa3ef37587d2af4964fd3586221d404303b09ca6d08860d54f4b9a3a58a9f6",
  "bin": "usbsafelyremovesetup_7-5-1.exe",
  "shortcuts": [
    [
      "usbsafelyremovesetup_7-5-1.exe",
      "USB Safely Remove"
    ]
  ],
  "checkver": {
    "script": [
      "try { Invoke-WebRequest -Uri 'https://safelyremove.com/startdownload.htm?imm&v=&t=zip' -MaximumRedirection 0 -ErrorAction Stop | Out-Null } catch {",
      "  $location = $_.Exception.Response.Headers['Location']",
      "  if ($location -match 'usbsafelyremovesetup_(?<version>\\d+(?:-\\d+)+)\\.zip') {",
      "    $matches.version -replace '-', '.'",
      "  }",
      "}"
    ]
  },
  "autoupdate": {}
}