{
  "version": "2.9.1",
  "description": "CodeCharta Visualization: interactive 3D maps of code metrics to analyze hotspots and architecture.",
  "homepage": "https://github.com/MaibornWolff/codecharta",
  "license": "BSD-3-Clause",
  "url": "https://github.com/MaibornWolff/codecharta/releases/download/vis-2.9.1/codecharta-visualization-win32-x64.zip",
  "hash": "sha256:34df221f4b1ce0305f5fa5ede63988fea3ae5f5ed9e72c54f3ffa034ed536c32",
  "extract_dir": "codecharta-visualization-win32-x64",
  "shortcuts": [
    [
      "codecharta-visualization.exe",
      "CodeCharta Visualization"
    ]
  ],
  "checkver": {
    "url": "https://api.github.com/repos/MaibornWolff/codecharta/releases/latest",
    "jsonpath": "$.tag_name",
    "regex": "vis-([\\d.]+)"
  },
  "autoupdate": {
    "url": "https://github.com/MaibornWolff/codecharta/releases/download/vis-$version/codecharta-visualization-win32-x64.zip"
  }
}
