{
  "version": "7.5.1",
  "description": "USB Safely Remove - Safely remove USB devices with additional features",
  "homepage": "https://safelyremove.com/download.htm",
  "license": "Shareware",
  "url": "https://safelyremove.com/startdownload.htm?imm&v=&t=#/USBSafelyRemove.exe",
  "hash": "sha256:8efceaf6070fd3ec48cdd7d6492e60d52433061d0067f6604b87c6803c8bd3a0",
  "bin": "USBSafelyRemove.exe",
  "shortcuts": [
    [
      "USBSafelyRemove.exe",
      "USB Safely Remove"
    ]
  ],
  "checkver": {
    "url": "https://safelyremove.com/download.htm",
    "regex": "Version:\\s*([0-9]+\\.[0-9]+(?:\\.[0-9]+)?)"
  },
  "autoupdate": {
    "url": "https://safelyremove.com/startdownload.htm?imm&v=&t=#/USBSafelyRemove.exe"
  }
}
