{
  "version": "9.3.0",
  "description": "Depressurizer - A Steam library categorizing tool",
  "homepage": "https://api.github.com/repos/julianxhokaxhiu/Depressurizer/releases/latest",
  "license": "GPL-3.0",
  "url": "https://github.com/julianxhokaxhiu/Depressurizer/releases/download/9.3.0/Depressurizer-v9.3.0.0_Release.zip",
  "hash": "sha256:3e0588db76a564291d1128b1cd203dc6bb7ca5661afc1ccd9efc2d37606cca3e",
  "bin": "Depressurizer.exe",
  "shortcuts": [
    [
      "Depressurizer.exe",
      "Depressurizer"
    ]
  ],
  "checkver": {
    "url": "https://api.github.com/repos/julianxhokaxhiu/Depressurizer/releases/latest",
    "regex": "\"tag_name\":\\s*\"v?([0-9]+\\.[0-9]+(?:\\.[0-9]+)?)\""
  },
  "autoupdate": {
    "url": "https://github.com/julianxhokaxhiu/Depressurizer/releases/download/$version/Depressurizer-v$version.0_Release.zip"
  }
}
