{
  "version": "1.1.5",
  "description": "Touch-free controller for use while eating. Control your device with gestures and voice commands without getting your hands dirty.",
  "homepage": "https://github.com/lanxiuyun/lazyeat",
  "license": "Freeware",
  "architecture": {
    "64bit": {
      "url": "https://github.com/lanxiuyun/lazyeat/releases/download/v1.1.5/Lazyeat_1.1.5_x64_en-US.msi",
      "hash": "sha256:291c7035db400ce489ba398980d63c16ec6e1b5b99281126d1c9c32545a8ef5c"
    }
  },
  "shortcuts": [
    [
      "PFiles\\Lazyeat\\Lazyeat.exe",
      "Lazyeat"
    ],
    [
      "PFiles\\Lazyeat\\Lazyeat Backend.exe",
      "Lazyeat Backend"
    ]
  ],
  "checkver": {
    "url": "https://api.github.com/repos/lanxiuyun/lazyeat/releases/latest",
    "jsonpath": "$.tag_name",
    "regex": "v([\\d.]+)"
  },
  "autoupdate": {
    "architecture": {
      "64bit": {
        "url": "https://github.com/lanxiuyun/lazyeat/releases/download/v$version/Lazyeat_$version_x64_en-US.msi"
      }
    }
  },
  "url": "https://github.com/lanxiuyun/lazyeat/releases/download/v1.1.4/Lazyeat_1.1.4_x64_en-US.msi",
  "hash": "0cd5da317f1b1c4677c5f4918e7f9aa7699e25d632a83665309fc4bb67fc4a0c"
}