{
  "version": "0.10.9",
  "description": "Ripgrep-All - Search in PDFs, e-books, Office docs, archives, and media via ripgrep",
  "homepage": "https://github.com/phiresky/ripgrep-all/releases",
  "license": "AGPL-3.0-or-later",
  "url": "https://github.com/phiresky/ripgrep-all/releases/download/v0.10.9/ripgrep_all-v0.10.9-x86_64-pc-windows-msvc.zip",
  "hash": "sha256:da03e969ac01839443739c547ca8eb521e648e712251d61a98d34a1521b9f43b",
  "bin": "rga.exe",
  "checkver": {
    "url": "https://github.com/phiresky/ripgrep-all/releases",
    "regex": "releases/tag/v(0\\.10\\.9)"
  },
  "autoupdate": {
    "url": "https://github.com/phiresky/ripgrep-all/releases/download/v$version/ripgrep_all-v$version-x86_64-pc-windows-msvc.zip"
  }
}
