{
  "version": "1.26.30",
  "description": "VeraCrypt - Disk encryption with strong security based on TrueCrypt",
  "homepage": "https://github.com/veracrypt/VeraCrypt",
  "license": "Apache-2.0",
  "architecture": {
    "64bit": {
      "url": "https://github.com/veracrypt/VeraCrypt/releases/download/VeraCrypt_1.26.30/VeraCrypt_Setup_x64_1.26.30.msi",
      "hash": "sha256:6164d4e4e8d8e600003f6cf14fafe7f50ce23b3452cae02ea19e5ad6f0cc41ad"
    }
  },
  "bin": "PFiles\\VeraCrypt\\VeraCrypt.exe",
  "shortcuts": [
    [
      "PFiles\\VeraCrypt\\VeraCrypt.exe",
      "VeraCrypt"
    ]
  ],
  "checkver": {
    "url": "https://api.github.com/repos/veracrypt/VeraCrypt/releases/latest",
    "jsonpath": "$.tag_name",
    "regex": "VeraCrypt_([\\d.]+)"
  },
  "autoupdate": {
    "architecture": {
      "64bit": {
        "url": "https://github.com/veracrypt/VeraCrypt/releases/download/VeraCrypt_$version/VeraCrypt_Setup_x64_$version.msi"
      }
    }
  }
}
