{
  "version": "26.10",
  "description": "SoftPerfect Cache Relocator - Relocate browser and app caches to another drive",
  "homepage": "https://www.softperfect.com/products/cacherelocator/",
  "license": "Freeware",
  "url": "https://www.softperfect.com/download/freeware/cacherelocator_portable.zip",
  "hash": "sha256:a1c7f94e6606b85f92d3f217ad43a2a140f95f6e73638961bfc5f817dd7426a0",
  "bin": "cacherelocator.exe",
  "shortcuts": [
    [
      "cacherelocator.exe",
      "Cache Relocator"
    ]
  ],
  "extract_dir": "64-bit",
  "checkver": {
    "url": "https://www.softperfect.com/products/cacherelocator/",
    "regex": "Latest version[\\s\\S]*?([0-9]+\\.[0-9]+)"
  },
  "autoupdate": {
    "url": "https://www.softperfect.com/download/freeware/cacherelocator_portable.zip"
  }
}
