{
  "version": "0.11.0.3",
  "description": "CoreCycler - CPU stress testing tool for stability testing",
  "homepage": "https://github.com/sp00n/corecycler",
  "license": "MIT",
  "url": "https://github.com/sp00n/CoreCycler/releases/download/v0.11.0.3/CoreCycler-v0.11.0.3.7z",
  "hash": "sha256:721ed2948b51a2fc7c60289ecb7cbf62057b22d54c4ba5dc70ac5a107fcc1a63",
  "bin": [
    [
      "Run CoreCycler.bat",
      "corecycler"
    ]
  ],
  "extract_dir": "CoreCycler-v0.11.0.3",
  "checkver": {
    "url": "https://github.com/sp00n/corecycler",
    "regex": "tag/v([0-9]+\\.[0-9]+\\.[0-9]+\\.[0-9]+(?:-[a-zA-Z0-9]+)?)"
  },
  "autoupdate": {
    "url": "https://github.com/sp00n/CoreCycler/releases/download/v$version/CoreCycler-v$version.7z",
    "extract_dir": "CoreCycler-v$version"
  }
}
