{
  "version": "10858",
  "description": "Chromium's certificate revocation list",
  "homepage": "https://www.chromium.org/Home/chromium-security/crlsets/",
  "license": "BSD-3-Clause",
  "url": "https://www.google.com/dl/release2/chrome_component/bgc3z5ybbm47pkurn42ywjn6m4_10858/hfnkpimlhhgieaddgfemjhofmfblmnib_10858_all_acozphgdazm53m4uj4jlwh65cada.crx3",
  "hash": "sha256:428736207a2c6ec08ab7a18de74da11aeeb342c171e3a13f3e8dc02a1cd4a017",
  "installer": {
    "script": [
      "$dest = \"$dir\\CertificateRevocation\"",
      "Expand-7zipArchive \"$dir\\$fname\" $dest -Removal",
      "Set-Content \"$dest\\manifest.fingerprint\" \"1.$($manifest.hash)\" -NoNewline"
    ]
  },
  "checkver": {
    "script": [
      "$url = 'https://clients2.google.com/service/update2/crx?x=id%3Dhfnkpimlhhgieaddgfemjhofmfblmnib%26v%3D%26uc%26acceptformat%3Dcrx3'",
      "$cont = Invoke-RestMethod -UseBasicParsing -Method Get -Headers @{'Accept-Encoding'='gzip'} -MaximumRedirection 0 -Uri $url",
      "$cont = $cont.gupdate.app.updatecheck",
      "Write-Output ('version:\"' + $cont.version + '\"') ('url:\"' + $cont.codebase + '\"')"
    ],
    "regex": "version:\"(\\d+)\"\\surl:\"(?:https?://.+/(?<urlone>.+)/(?<basename>.+)\\.crx3)\""
  },
  "autoupdate": {
    "url": "https://www.google.com/dl/release2/chrome_component/$matchUrlone/$matchBasename.crx3",
    "hash": {
      "url": "https://clients2.google.com/service/update2/crx?x=id%3Dhfnkpimlhhgieaddgfemjhofmfblmnib%26v%3D%26uc%26acceptformat%3Dcrx3",
      "regex": "hash_sha256=\"([a-fA-F0-9]{64})\""
    }
  }
}
